qid;question;keyPhrases;obj;txt;col;cnt;oth,,,,,
309086001;Are these men playing a game?;['men', 'game'];1;0;0;0;0,,,,
309135008;What is the color of the zebra?;['color', 'zebra'];1;0;1;0;0,,,,
309267000;Is that a chopping board?;['chopping board'];1;0;0;0;0,,,,,
309404018;What kind of fabric is the object made of?;['kind of fabric', 'object'];1;0;0;0;0,,,,
309502014;What are the colors of the four rings on the toy in the bookshelf?;['rings', 'toy', 'bookshelf', 'colors'];1;1;1;1;0,,
309531009;What is the color of the wall?;['color', 'wall'];1;0;1;0;0,,,,
309563002;What does the sticker say?;['sticker'];1;1;0;0;0,,,,,
309679003;Is this an ergonomic wave keyboard?;['ergonomic wave keyboard'];1;0;0;0;0,,,,,
309714002;Is this an old-fashioned living room?;['old-fashioned living room'];1;0;0;0;0,,,,,
309856003;Has there been other people skiing here?;['people'];1;0;1;0;0,,,,,
309944013;Is there a light switch on one of the doors?;['light switch', 'doors'];1;0;1;0;0,,,,
310055005;Is this a commercial passenger plane?;['commercial passenger plane'];1;0;0;0;0,,,,,
310079006;Is everyone playing?;[];1;0;1;0;0,,,,,
310134001;What breed of dog is in this photo?;['dog', 'photo'];1;0;1;0;0,,,,
310450005;How many containers are there?;['containers'];1;0;0;1;0,,,,,
310463002;How many pieces of paper are on the table?;['pieces of paper', 'table'];1;1;0;1;0,,,,
310561002;What decade is this photo from?;['decade', 'photo'];1;0;0;1;0,,,,
310752003;What color is the plate?;['color', 'plate'];1;0;1;0;0,,,,
310783009;Why are they wearing white?;['white'];1;1;1;0;0,,,,,
310851010;How many buses are there?;['buses'];1;0;0;1;0,,,,,
310903001;Does this person look serious?;['person'];1;0;0;0;0,,,,,
310926039;What is the name of the bus?;['bus'];1;1;0;0;0,,,,,
310978001;What are the main colors in the picture?;['main colors', 'picture'];0;0;1;0;0,,,,
311128002;Is this room narrow?;['room'];1;0;0;0;0,,,,,
311550006;What number is on the train?;['number', 'train'];1;1;0;0;0,,,,
311620004;Was this picture taken recently?;['picture'];1;0;1;0;0,,,,,
311641005;What kind of trees are there?;['kind of trees'];1;0;0;0;0,,,,,
311827001;How many cameras do you see?;['cameras'];1;0;0;1;0,,,,,
311882004;How many pieces of fruit can be seen?;['pieces of fruit'];1;0;0;1;0,,,,,
312054010;How many cars can be seen?;['cars'];1;0;0;1;0,,,,,
312212001;What is the dog sniffing?;['dog sniffing'];1;1;0;0;0,,,,,
312218026;Is there any street light?;['street light'];1;0;0;0;0,,,,,
312465003;Has this image been photoshopped?;['image'];1;0;0;0;0,,,,,
312630001;What color is the dead grass?;['color', 'dead grass'];1;0;1;0;0,,,,
312671001;Are they having a business meeting?;['business meeting'];1;0;0;0;0,,,,,
312748001;What color is this unique vehicle?;['color', 'unique vehicle'];1;0;1;0;0,,,,
312997001;How many books?;['books'];1;0;0;1;0,,,,,
313071003;Where is the woman looking?;['woman'];1;0;0;0;0,,,,,
313148003;What is still on the tray?;['tray'];1;0;0;0;0,,,,,
313306003;What is in the sky?;['sky'];1;0;1;0;0,,,,,
313582006;What color is her tie?;['color', 'tie'];1;0;1;0;0,,,,
313666015;How full of water is the vase?;['water', 'vase'];1;0;1;0;0,,,,
313694001;What animal is on the diaper?;['animal', 'diaper'];1;0;0;0;0,,,,
313984002;What is on the paper?;['paper'];1;0;0;0;0,,,,,
314385000;Is this person a homosexual?;['person', 'homosexual'];1;0;0;0;0,,,,
314554004;Is the snow deep?;['snow'];1;0;0;0;0,,,,,
314561012;Are these vessels watertight?;['vessels watertight'];1;0;0;0;0,,,,,
314816001;Is it raining?;[];1;0;0;0;0,,,,,
314845007;What kind of food is this?;['kind of food'];1;0;0;0;0,,,,,
314846002;What is the baby eating?;['baby eating'];1;0;0;0;0,,,,,
31524000;Is there a peace sign here?;['peace sign'];1;1;0;0;0,,,,,
315256022;Is the bed a king size bed?;['king size bed'];1;0;0;0;0,,,,,
315268001;Could that be a navel orange?;['navel orange'];1;0;0;0;0,,,,,
315269003;Is this the entry to a ski lift?;['entry', 'ski lift'];1;1;0;0;0,,,,
315637003;Are the cords organized neatly?;['cords'];1;0;0;0;0,,,,,
315734001;What are the chains used for on the back of the truck?;['chains', 'truck'];1;0;1;0;0,,,,
315856000;In what direction is the sun shining from?;['direction'];1;0;1;0;0,,,,,
315960001;How many people are washing this elephant?;['people', 'elephant'];1;1;0;1;0,,,,
315964001;What color is the girl's hair?;['color'," ""girl's hair""];1;0;1;0;0",,,,
315994015;What kind of person would use these objects?;['kind of person', 'objects'];1;0;1;0;0,,,,
316012000;What brand of shorts is the man wearing?;['brand of shorts', 'man'];1;0;0;0;0,,,,
316093000;Are they riding on a horse trail?;['horse trail'];1;0;0;0;0,,,,,
31616000;Is this man playing bowling on an Xbox?;['man', 'bowling', 'Xbox'];1;0;0;0;0,,,
316170000;Does this look like a healthy meal?;['healthy meal'];1;0;1;0;0,,,,,
316250009;What color is the clock?;['color', 'clock'];1;0;1;0;0,,,,
316343000;What sport is this?;['sport'];1;0;1;0;0,,,,,
316343014;How any patterns of checkered?;['patterns of checkered'];1;0;1;1;0,,,,,
31666006;What is the gage of the track the train sits on?;['gage', 'track', 'train'];1;0;0;0;0,,,
316663005;Is the person eating a sandwich with a fork?;['person', 'sandwich', 'fork'];1;0;0;0;0,,,
316802005;What does the elephant have to play with?;['elephant'];1;0;0;0;0,,,,,
316817006;What is the floor made of?;['floor'];1;0;0;0;0,,,,,
316825001;What type of park is this?;['type of park'];1;0;1;0;0,,,,,
317227060;What color is the cutting board?;['color', 'cutting board'];1;0;1;0;0,,,,
317464000;Is the item shown from a distance or up close?;['distance', 'item'];1;0;0;0;1,,,,
317474000;What kind of container are the vegetables sitting in?;['kind of container', 'vegetables'];1;0;0;0;0,,,,
317819001;Will anyone be boarding these trains?;['trains'];1;0;1;0;0,,,,,
317833005;Is someone having lunch in an Asian restaurant?;['lunch', 'Asian restaurant'];1;0;0;0;0,,,,
317833052;What is sitting behind the plate?;['plate'];1;0;0;0;0,,,,,
"317851000;Why is the car's hood up?;[""car's hood""];1;0;1;0;0",,,,,
317878018;How can we tell this is not in America?;['America'];1;1;0;0;0,,,,,
318073030;What room is the man standing in the photo?;['man', 'room', 'photo'];1;0;0;0;0,,,
31822018;What number is on the sign?;['number', 'sign'];1;0;0;1;0,,,,
318598059;What is the man in orange doing?;['man', 'orange'];1;0;1;0;0,,,,
318768002;How many steps are in the picture?;['steps', 'picture'];1;0;0;1;0,,,,
318857001;What animal is on the man's lap?;['animal'," ""man's lap""];1;0;1;0;0",,,,
319163003;What is happening in this picture?;['picture'];1;0;0;0;0,,,,,
319339009;How many steps lead to the door?;['steps', 'door'];1;0;0;1;0,,,,
319339013;How many black pots are there?;['black pots'];1;0;1;1;0,,,,,
319517003;How many people are rowing boats?;['people', 'rowing boats'];1;0;0;1;0,,,,
319626006;Was the photo taken near a body of water?;['photo', 'body of water'];1;0;0;0;0,,,,
320008002;What time is it on the watch?;['time', 'watch'];1;1;0;1;0,,,,
320112003;What type of car is that?;['type of car'];1;1;0;0;0,,,,,
320131010;Did the man jump before the picture was taken?;['man', 'picture'];1;0;0;0;0,,,,
320234001;Is the child teaching the man how to play frisbee?;['man', 'child', 'frisbee'];1;0;0;0;0,,,
320353003;How many bikes are in the photo?;['bikes', 'photo'];1;0;0;1;0,,,,
320445001;How many buildings are in the background?;['buildings', 'background'];1;0;0;1;0,,,,
320523001;Is the sun shining?;[];1;0;1;0;0,,,,,
32060005;What year is it?;['year'];1;1;0;1;0,,,,,
32067000;Are there cars on the bridge?;['cars', 'bridge'];1;0;1;0;0,,,,
320722002;Are there animals in the forest?;['animals', 'forest'];1;0;0;0;0,,,,
320722004;Where are the sheep?;['sheep'];1;0;0;0;0,,,,,
320770006;How many plates are there?;['plates'];1;0;0;1;0,,,,,
320840000;How many feet has this person jumped in the air?;['person', 'feet', 'air'];1;0;0;1;0,,,
320911003;How many people are walking toward the plane?;['people', 'plane'];1;0;0;1;0,,,,
32095003;Are there vegetarian options available?;['vegetarian options available'];1;0;0;0;0,,,,,
32126002;Are they having rice with this?;['rice'];1;0;0;0;0,,,,,
321410006;What is the name of the building or lodge?;['building', 'lodge'];1;1;0;0;0,,,,
32149001;What color is her shirt?;['color', 'shirt'];1;0;1;0;0,,,,
321491012;Is the giraffe in a zoo?;['giraffe', 'zoo'];1;0;0;0;0,,,,
321492000;What color is the court?;['color', 'court'];1;0;1;0;0,,,,
321841003;What color is the girl's hair?;['color'," ""girl's hair""];1;0;1;0;0",,,,
321907002;Can this person fall?;['person'];1;0;0;0;0,,,,,
321907005;What color is her outfit?;['color', 'outfit'];1;0;1;0;0,,,,
3220004;Is a ball being thrown?;['ball'];1;1;0;0;0,,,,,
3224002;Are there giraffes in a large cage?;['giraffes', 'large cage'];1;0;0;0;0,,,,
322662001;Is this a spectator event?;['spectator event'];1;0;0;0;0,,,,,
322869000;Is it cloudy?;[];1;0;1;0;0,,,,,
32289009;How long are the benches?;['benches'];1;0;0;1;1,,,,,
323125000;What sport is this person in?;['sport', 'person'];1;0;0;0;1,,,,
323133003;How many windows are open?;['windows'];1;0;1;1;0,,,,,
323252000;How many windows?;['windows'];1;0;0;1;0,,,,,
323347001;What is this person looking at?;['person'];1;0;0;0;0,,,,,
323352002;Are there waves in the water?;['waves', 'water'];1;0;0;0;0,,,,
323360002;What number is this train?;['number', 'train'];1;1;1;0;0,,,,
323519000;Where could a weary traveler rest?;['weary traveler rest'];1;0;0;0;0,,,,,
323666006;Is this person in danger of falling?;['person', 'danger'];1;0;1;0;0,,,,
324006015;Are some spectators wearing hats?;['spectators', 'hats'];1;0;0;0;0,,,,
32405001;Is this photo an invasion of the cat's privacy?;['photo', 'invasion'," ""cat's privacy""];1;0;1;0;0",,,
32405002;What is this type of photo called?;['type of photo'];1;0;1;0;0,,,,,
324156014;What is the person doing?;['person'];1;0;1;0;0,,,,,
324334000;Is that a real lantern?;['real lantern'];1;0;0;0;0,,,,,
324580012;If you pay for a ticket will your car get towed?;['ticket', 'car'];1;1;0;0;0,,,,
324971002;Is the water foamy?;['water foamy'];1;0;0;0;0,,,,,
324971004;Is this person an experienced surfer?;['person', 'experienced surfer'];1;0;1;0;0,,,,
324977003;Is the key forward slash visible?;['key forward slash visible'];1;0;0;0;0,,,,,
325021000;Are there any Africans in the photo?;['Africans', 'photo'];1;0;0;0;0,,,,
325079002;Do you think this vendor will have a successful day selling these products in the rain?;['successful day', 'products', 'vendor', 'rain'];1;0;0;0;0,,
325215010;Who is wearing the reflective belt?;['reflective belt'];1;0;1;0;0,,,,,
325287005;Are they comparing their phones?;['phones'];1;0;0;0;0,,,,,
325384000;Is this bird a nurturing animal?;['bird', 'nurturing animal'];1;0;0;0;0,,,,
325595005;What is the guy on the beach wearing?;['guy', 'beach'];1;0;1;0;0,,,,
32578001;Is the cat eating?;['cat eating'];1;0;0;0;0,,,,,
325799004;How many flowers are there?;['flowers'];1;0;0;1;0,,,,,
325799020;Do you think these flowers are natural?;['flowers'];1;1;0;0;0,,,,,
325903001;Can you see any flowers in the vases?;['flowers', 'vases'];1;0;0;0;0,,,,
326156004;Was the sheep recently shorn?;['sheep'];1;0;0;0;0,,,,,
326293002;What fruit is there?;['fruit'];1;0;0;0;0,,,,,
326390000;How many shadows are being cast in this photo?;['shadows', 'photo'];1;0;1;1;0,,,,
32664001;What color is the board?;['color', 'board'];1;0;1;0;0,,,,
326706003;Who is winning?;[];1;0;0;0;0,,,,,
326734001;Which bowl is empty?;['bowl'];1;0;0;0;0,,,,,
326805004;What is the purpose of the item under the umbrella?;['purpose', 'item', 'umbrella'];1;0;0;0;0,,,
327032001;Which person is not watching the game?;['person', 'game'];1;0;0;0;0,,,,
327110000;Is the man in the hat watching the women?;['man', 'hat', 'women'];1;0;0;0;0,,,
327144006;What type of bird is this?;['type of bird'];1;0;1;0;0,,,,,
327146002;Is the cat on it's belly?;['cat', 'belly'];1;0;0;0;0,,,,
327217003;What is in the air?;['air'];1;0;0;0;0,,,,,
327262001;How many kites are already flying?;['kites'];1;0;0;1;0,,,,,
327462004;Is the person sad?;['person sad'];1;0;1;0;0,,,,,
327575001;What are the people riding?;['people'];1;0;0;0;0,,,,,
"327586003;What pattern is on the girl's outfit who is on the bike?;[""girl's outfit""", 'pattern', 'bike'];1;0;1;0;0,,,
327805005;Is the woman on the left more than?;['woman', 'left'];1;0;0;0;0,,,,
327841005;Is the white car moving?;['white car'];1;0;1;0;0,,,,,
328069001;How many cats in the picture?;['cats', 'picture'];1;0;0;1;0,,,,
32809001;Which bus it is?;[];1;1;1;0;0,,,,,
328179006;What color are the ladies shorts?;['color', 'ladies shorts'];1;0;1;0;0,,,,
328179011;What number is on the shirt?;['number', 'shirt'];1;1;1;1;0,,,,
32829000;What is she pulling?;[];1;0;0;0;0,,,,,
328454006;Are the giraffes hungry?;['giraffes hungry'];1;0;0;0;0,,,,,
328473005;Do trees line both sides of the street, or only one side?;['trees line', 'sides', 'street'];1;0;0;0;0,,
328569002;Is this person skiing downhill?;['person'];1;0;1;0;0,,,,,
328652001;How many trees are there?;['trees'];1;0;0;1;0,,,,,
328783005;Are they in the wild?;[];1;0;0;0;0,,,,,
328783013;Are the giraffes looking up or down?;['giraffes'];1;0;0;1;0,,,,,
328853002;What kind of dish is on the plate?;['kind of dish', 'plate'];1;0;0;0;0,,,,
328855003;Are there any suitcases on the table?;['suitcases', 'table'];1;0;0;0;0,,,,
32893027;What kind of sauce is on this meat?;['kind of sauce', 'meat'];1;0;0;0;0,,,,
328978010;Is that a softball or baseball?;['softball', 'baseball'];1;0;0;0;0,,,,
329055006;What color is the kite?;['color', 'kite'];1;0;1;0;0,,,,
32906002;How many people are wearing long pants?;['people', 'long pants'];1;0;0;1;0,,,,
329090006;What is the girl doing with her hand?;['girl', 'hand'];1;0;0;0;0,,,,
329107002;Is he skating in a shopping center?;['shopping center'];1;0;1;0;0,,,,,
329107008;What is the man skateboarding off of?;['man'];1;0;0;0;0,,,,,
329125001;Does this person look good in a short-sleeve shirt?;['short-sleeve shirt', 'person'];1;0;1;0;0,,,,
3293008;What time does the clock show according to standard American time?;['standard American time', 'clock'];1;1;0;1;0,,,,
329386036;How many people are wearing leather jackets?;['people', 'leather jackets'];1;0;0;1;0,,,,
329386040;What is his reaction?;['reaction'];1;0;1;0;0,,,,,
329386058;How many people are eating in this picture?;['people', 'picture'];1;0;0;1;0,,,,
329411000;How many desserts are there?;['desserts'];1;0;0;1;0,,,,,
329558005;Are the trains identical?;['trains identical'];1;0;1;0;0,,,,,
329675002;Why is the pizza inside of a glass case?;['pizza', 'glass case'];1;0;0;0;0,,,,
329684002;Why are there three people in close proximity the tower?;['people', 'close proximity', 'tower'];1;0;0;1;0,,,
329707008;Is the person falling or rising?;['person'];1;0;0;0;0,,,,,
329782003;Is this a cake?;['cake'];0;0;0;0;0,,,,,
32986003;Why does the elephant have a blanket?;['elephant', 'blanket'];1;0;1;0;0,,,,
329942000;Are all these people adults?;['people adults'];1;0;0;0;0,,,,,
330054009;What is the weather like?;['weather'];1;0;1;0;0,,,,,
330100000;Why are people standing?;['people'];1;0;1;0;0,,,,,
330139004;What number of elephants are standing in the river?;['number of elephants', 'river'];1;0;0;1;0,,,,
330253001;How many means of transportation are here?;['means of transportation'];1;0;0;1;0,,,,,
330357004;What color plate is the food on?;['color plate', 'food'];1;0;1;0;0,,,,
330395002;Is the truck stopped?;['truck'];1;0;0;0;0,,,,,
330498000;How many pillows are on the couches?;['pillows', 'couches'];1;1;0;1;0,,,,
330572009;Is the man happy?;['man happy'];1;0;0;0;0,,,,,
330650010;How many lights are visible?;['lights'];1;0;0;1;0,,,,,
330909002;Is there any food on the table?;['food', 'table'];1;0;1;0;0,,,,
33093001;What is the man holding in  his left hand?;['man', 'left hand'];1;0;0;0;0,,,,
331105003;What number of green bananas are in the bunch?;['number of green bananas', 'bunch'];1;0;0;1;0,,,,
33127008;How active are these animals?;['animals'];1;0;0;0;0,,,,,
331353005;What time does the clock say?;['time', 'clock'];1;1;0;1;0,,,,
331616007;Why is the person bent over?;['person'];1;0;1;0;0,,,,,
331780002;Are all the dogs feet touching the ground?;['dogs feet', 'ground'];1;0;1;0;0,,,,
331978000;Is it daytime or nighttime?;['nighttime'];1;0;1;0;0,,,,,
332020002;Could those flowers be artificial?;['flowers'];1;0;0;0;0,,,,,
332078005;What type of dog is this?;['type of dog'];1;0;1;0;0,,,,,
332109002;Where are the sketches?;['sketches'];1;0;1;0;0,,,,,
332193002;Is this an Indian or an African elephant?;['African elephant'];1;0;0;0;0,,,,,
332210017;What powers this locomotive?;['locomotive'];1;0;0;0;0,,,,,
332273008;Which person is most likely to catch the ball?;['person', 'ball'];1;0;1;0;0,,,,
332273014;Was the runner safe?;['runner safe'];1;0;0;0;0,,,,,
332434003;How tall is the lady in the mirror?;['lady', 'mirror'];1;0;0;0;0,,,,
332498000;Is this an adult giraffe?;['adult giraffe'];1;0;0;0;0,,,,,
333088001;How many tables are in the room?;['tables', 'room'];1;0;0;1;0,,,,
333099001;What is coming out of the train?;['train'];1;0;1;0;0,,,,,
333431006;What sport is this guy doing?;['sport', 'guy'];1;0;1;0;0,,,,
33358001;Is there fire in the forest?;['forest'];1;0;0;0;0,,,,,
333586004;Is the animal living in vegetation that its coloring blends in with?;['animal living', 'vegetation', 'coloring'];1;0;1;0;0,,,
333643003;What brand is the computer the woman is holding?;['brand', 'computer', 'woman'];1;1;0;0;0,,,
333643005;What brand of computer is the boy using?;['brand of computer', 'boy'];1;1;0;0;0,,,,
333978006;What brand is the orange juice?;['brand', 'orange juice'];1;1;0;0;0,,,,
333978014;How many jars are visible?;['jars'];1;0;1;1;0,,,,,
334059003;Do you see a chain link fence?;['chain link fence'];1;0;0;0;0,,,,,
334109001;Are these colored balls reminiscent of a popular sugar-coated cereal?;['popular sugar-coated cereal', 'colored balls reminiscent'];1;0;1;1;0,,,,
334180000;Where is the man?;['man'];1;0;0;0;0,,,,,
334206001;Is it a nice day?;['nice day'];1;0;1;0;0,,,,,
334320001;Is it normal for cows to be there?;['cows'];1;0;0;0;1,,,,,
334328001;Is this kitchen using too much wood?;['kitchen', 'wood'];1;0;0;0;0,,,,
334380003;Is there a table in the image?;['table', 'image'];1;0;0;0;0,,,,
334381001;What kind of shoes are these?;['kind of shoes'];1;0;1;0;0,,,,,
334448002;Do you see red paint on the elephant?;['red paint', 'elephant'];1;0;1;0;0,,,,
334484000;What color are the letters on the bus?;['color', 'letters', 'bus'];1;1;1;0;0,,,
334585000;How many ostriches are there in the picture?;['ostriches', 'picture'];1;0;0;1;0,,,,
334588005;What safety gear are these people wearing?;['safety gear', 'people'];1;0;0;0;0,,,,
"334699000;What's the motorcycle's number?;[""motorcycle's number""];1;1;0;0;0",,,,,
334751011;Is the woman interested in the animal?;['woman', 'animal'];1;0;0;0;0,,,,
334822002;Is the water fairly clear?;['water'];1;0;1;0;0,,,,,
334958003;How many clock faces are there?;['clock faces'];1;0;0;1;0,,,,,
335003017;What color is the child's eyes?;['color'," ""child's eyes""];1;0;1;0;0",,,,
335093007;How many chairs?;['chairs'];1;0;0;1;0,,,,,
335106000;Where are the animals looking?;['animals'];1;0;0;0;0,,,,,
"335111004;How many 'bike baskets' are there in the photo?;[""bike baskets'""", 'photo'];1;0;0;1;0,,,,
335308002;How many pillows are on the furniture, excluding the ones that are part of the furniture?;['furniture', 'ones', 'pillows'];1;0;0;1;0,,
335434003;How many people are in this photo?;['people', 'photo'];1;0;0;1;0,,,,
335566000;Do you think the giraffes are curious about the geese across from them on the grass?;['geese', 'giraffes', 'grass'];1;0;1;0;0,,,
335781001;Is it a cloudy day?;['cloudy day'];1;0;1;0;0,,,,,
335840000;What gender are the people in the picture?;['gender', 'people', 'picture'];1;1;0;0;0,,,
336221003;Where is the billboard?;['billboard'];1;0;0;0;0,,,,,
336350003;How many people are in yellow shirts?;['people', 'yellow shirts'];1;0;1;1;0,,,,
336350004;What kind of shoes are these people wearing?;['kind of shoes', 'people'];1;0;1;0;0,,,,
336621002;Is there only one fruit?;['fruit'];1;0;0;1;0,,,,,
336939005;Where is the crane?;['crane'];1;0;0;0;0,,,,,
336959002;Is the man wearing pants?;['man', 'pants'];1;0;1;0;0,,,,
336966005;What is the name of the Airways?;['Airways'];1;1;0;0;0,,,,,
337167006;What kind of animal is laying down?;['kind of animal'];1;0;0;0;0,,,,,
"33718005;Do they look impressed with the skateboarder's demonstration?;[""skateboarder's demonstration""];1;0;0;0;0",,,,,
337297000;Are the giraffes in their natural habitat?;['giraffes', 'natural habitat'];1;0;0;0;0,,,,
337304001;What is the elephant doing with its trunk?;['elephant', 'trunk'];1;0;0;0;0,,,,
337416005;Is she standing?;[];1;0;0;0;0,,,,,
337425000;Why are there so many together?;[];1;0;1;1;0,,,,,
337448002;How many computers are here?;['computers'];1;0;0;1;0,,,,,
337546010;Could this room be in a dorm?;['room', 'dorm'];1;0;0;0;0,,,,
337594002;Is this an old car or a new car?;['old car', 'new car'];1;0;0;0;0,,,,
337602000;What colors are the kite?;['colors', 'kite'];1;0;1;0;0,,,,
337638001;How many colors can be seen in this picture?;['colors', 'picture'];1;0;1;1;0,,,,
337745006;Do you think that these strawberries are fresh?;['strawberries'];1;0;0;0;0,,,,,
338086000;Is it sunny?;[];1;0;1;0;0,,,,,
338167002;What is the girl doing?;['girl'];1;0;0;0;0,,,,,
338215002;IS the giraffe in a zoo?;['giraffe', 'zoo'];1;0;1;0;0,,,,
338228000;How many different toppings are on this pizza?;['different toppings', 'pizza'];1;0;0;1;0,,,,
"338363000;How many story's is the building?;[""story's""", 'building'];1;0;0;1;0,,,,
338736000;Is there a lot of green grass?;['lot of green grass'];1;0;1;0;0,,,,,
338833001;How many people are riding bikes?;['people', 'bikes'];1;0;0;1;0,,,,
338972006;What color is the ground?;['color', 'ground'];1;0;1;0;0,,,,
33902001;Which elephant is drinking?;['elephant'];1;0;0;0;0,,,,,
339240001;What is this girl doing?;['girl'];1;0;0;0;0,,,,,
339307003;Is this a leisurely game?;['leisurely game'];1;0;0;0;0,,,,,
339355002;How many keys do you see?;['keys'];1;0;0;1;0,,,,,
339382000;Is it a sunny day?;['sunny day'];1;0;1;0;0,,,,,
33955002;Has this room been cleaned?;['room'];1;0;1;0;0,,,,,
33955003;Has someone already used this towel?;['towel'];1;0;1;0;0,,,,,
339862000;How many fruits are in the picture?;['fruits', 'picture'];1;0;0;1;0,,,,
340171001;Are these people eating?;['people'];1;0;0;0;0,,,,,
"34019000;Is this a lady's bike?;[""lady's bike""];1;0;0;0;0",,,,,
340197004;What is the woman doing?;['woman'];1;0;0;0;0,,,,,
340215002;What color is the dog in this picture?;['color', 'dog', 'picture'];1;0;1;0;0,,,
340261001;Is there salami on the pizza?;['salami', 'pizza'];1;0;1;0;0,,,,
340441003;Is the man holding something in his right hand?;['man', 'right hand'];1;0;0;0;0,,,,
340454001;What is the sign there to prevent?;['sign'];1;1;0;0;0,,,,,
340494001;Are there a lot of children in this photo?;['lot of children', 'photo'];1;0;0;1;0,,,,
340498006;Has the diner had dinner yet?;['diner', 'dinner'];1;0;1;0;0,,,,
340501006;Is this person jumping off of the fire hydrant?;['person', 'hydrant'];1;0;0;0;0,,,,
340528016;What time does the clock have?;['time', 'clock'];1;1;0;0;0,,,,
340544003;Is the train moving through a city?;['train', 'city'];1;0;1;0;0,,,,
340598001;Where are the dogs sleeping at?;['dogs'];1;0;0;0;0,,,,,
340610001;Is this person near the shore?;['person', 'shore'];1;0;0;0;0,,,,
340659000;Is the man happy?;['man happy'];1;0;1;0;0,,,,,
340733003;How many slices are missing?;['slices'];1;0;0;1;0,,,,,
341054000;How many bowls?;['bowls'];1;0;0;1;0,,,,,
341062001;Is this cross-section crowded?;['cross-section'];1;0;1;0;0,,,,,
341328001;Did the toy belong to a boy?;['toy', 'boy'];1;0;0;0;0,,,,
"341448000;What are the spectator's standing behind?;[""spectator's standing""];1;0;0;0;0",,,,,
341455002;How many of the diners are overweight?;['diners'];1;0;0;1;0,,,,,
341781000;What is in the glass jar on the right?;['glass jar', 'right'];1;0;1;0;0,,,,
341892012;How many people are wearing hats?;['people', 'hats'];1;0;0;1;0,,,,
342092002;How many planes are there?;['planes'];1;0;0;1;0,,,,,
342132001;Is this a tropical environment?;['tropical environment'];1;0;1;0;0,,,,,
342184002;Would a vegetarian eat this?;['vegetarian'];1;0;0;0;0,,,,,
342307000;Is this an medical tool?;['medical tool'];1;0;1;0;0,,,,,
342353001;What kind of hats are worn?;['kind of hats'];1;0;1;1;0,,,,,
342411001;What is the pattern on the bowtie?;['pattern', 'bowtie'];1;0;1;0;0,,,,
342532006;Does this appear to be in the USA?;['USA'];1;1;0;0;0,,,,,
342639003;How many glasses does the woman have?;['glasses', 'woman'];1;0;0;1;0,,,,
342704004;Is the game over?;['game'];1;0;0;0;0,,,,,
342766001;What type of boat is seen on far right in background?;['type of boat', 'background'];1;0;0;0;0,,,,
342969003;What team is this player on?;['team', 'player'];1;0;0;0;0,,,,
343169002;Is there anything on the stove?;['stove'];1;0;0;0;0,,,,,
343282000;Is the person on skies sitting on the ground?;['person', 'skies', 'ground'];1;0;0;0;0,,,
343322004;Is this picture taken in the United States?;['picture', 'United States'];1;0;0;0;0,,,,
343407034;How many men are wearing sunglasses?;['men', 'sunglasses'];1;0;1;1;0,,,,
343503001;What is the color of the stool?;['color', 'stool'];1;0;1;0;0,,,,
343608003;Where are the shoes?;['shoes'];1;0;1;0;0,,,,,
343847004;Are they standing or eating?;[];1;0;0;0;0,,,,,
343863003;What color are the items on the wall?;['color', 'items', 'wall'];1;0;1;0;0,,,
34389000;Are there any kittens in the picture?;['kittens', 'picture'];1;0;0;1;0,,,,
